{
  "metadata": {
    "skill_name": "pdf",
    "skill_path": "/path/to/pdf",
    "executor_model": "claude-sonnet-4-20250514",
    "analyzer_model": "most-capable-model",
    "timestamp": "2026-01-15T10:30:00Z",
    "evals_run": [1, 2, 3],
    "runs_per_configuration": 3
  },
  "runs": [
    {
      "eval_id": 1,
      "eval_name": "Ocean",
      "configuration": "with_skill",
      "run_number": 1,
      "result": {
        "pass_rate": 0.85,
        "passed": 6,
        "failed": 1,
        "total": 7,
        "time_seconds": 42.5,
        "tokens": 3800,
        "tool_calls": 18,
        "errors": 0
      },
      "expectations": [{ "text": "...", "passed": true, "evidence": "..." }],
      "notes": ["Used 2023 data, may be stale", "Fell back to text overlay for non-fillable fields"]
    }
  ],
  "run_summary": {
    "with_skill": {
      "pass_rate": { "mean": 0.85, "stddev": 0.05, "min": 0.8, "max": 0.9 },
      "time_seconds": { "mean": 45.0, "stddev": 12.0, "min": 32.0, "max": 58.0 },
      "tokens": { "mean": 3800, "stddev": 400, "min": 3200, "max": 4100 }
    },
    "without_skill": {
      "pass_rate": { "mean": 0.35, "stddev": 0.08, "min": 0.28, "max": 0.45 },
      "time_seconds": { "mean": 32.0, "stddev": 8.0, "min": 24.0, "max": 42.0 },
      "tokens": { "mean": 2100, "stddev": 300, "min": 1800, "max": 2500 }
    },
    "delta": {
      "pass_rate": "+0.50",
      "time_seconds": "+13.0",
      "tokens": "+1700"
    }
  },
  "notes": [
    "Assertion 'Output is a PDF file' passes 100% in both configurations - may not differentiate skill value",
    "Eval 3 shows high variance (50% ± 40%) - may be flaky or model-dependent",
    "Without-skill runs consistently fail on table extraction expectations",
    "Skill adds 13s average execution time but improves pass rate by 50%"
  ]
}
